outlet,wave,status,account_required,target_url,asset,copy_source,next_action,notes
GitHub Discussions,0,live,no,https://github.com/TerminallyLazy/Tree-Ring-Memory/discussions/27,none,discussion post,monitor replies,Launch announcement created.
Homebrew tap,0,live,no,https://github.com/TerminallyLazy/homebrew-tree-ring,marketing/assets/homebrew-install-card-1200x675.png,Formula/tree-ring.rb,link from install docs and launch posts,macOS ARM64 formula audited and tested.
Crates.io packages,1,ready,yes,https://crates.io/,none,Cargo.toml,publish with owner-controlled crates.io token in order core -> sqlite -> cli,Package names returned no current cargo search matches. Core dry-run passes. SQLite and CLI manifests include publishable internal dependency versions and require core first.
Atom feed,0,live,no,https://terminallylazy.github.io/Tree-Ring-Memory/feed.xml,none,docs/feed.xml,watch Pages publish,Use for syndication and crawler discovery.
Hacker News Show HN,1,ready,yes,https://news.ycombinator.com/submit,marketing/assets/open-graph-1200x675.png,marketing/channel-playbook.md#hacker-news,post from verified maker account,Do not ask for upvotes.
X launch thread,1,ready,yes,https://x.com/home,marketing/assets/not-transcript-dump-card-1080x1080.png,marketing/channel-playbook.md#x,create profile and pin launch thread,Use TreeRingMemory handle if available.
YouTube demo,1,ready,yes,https://studio.youtube.com/,outputs/marketing/youtube-demo/tree-ring-memory-demo.mp4,marketing/youtube/,upload unlisted then publish,Custom thumbnail may require verification.
Reddit r/rust,2,ready,yes,https://www.reddit.com/r/rust/,marketing/assets/rust-article-card-1200x675.png,marketing/channel-playbook.md#rrust,read current rules then post if allowed,Prefer project/showcase thread if required.
Reddit r/LocalLLaMA,2,ready,yes,https://www.reddit.com/r/LocalLLaMA/,marketing/assets/reddit-link-card-1600x900.png,marketing/channel-playbook.md#rlocalllama,read current rules then post if allowed,Focus local-first and privacy.
Reddit r/opensource,2,ready,yes,https://www.reddit.com/r/opensource/,marketing/assets/reddit-link-card-1600x900.png,marketing/channel-playbook.md#ropensource,read current rules then post if allowed,Focus MIT and public repo.
Reddit r/commandline,2,queued,yes,https://www.reddit.com/r/commandline/,marketing/assets/reddit-link-card-1600x900.png,marketing/channel-playbook.md,prepare CLI-focused variant,Emphasize Rust CLI and TUI.
Reddit r/AI_Agents,2,queued,yes,https://www.reddit.com/r/AI_Agents/,marketing/assets/reddit-link-card-1600x900.png,marketing/channel-playbook.md,prepare adapter-focused variant,Check self-promotion policy.
Bluesky,2,ready,yes,https://bsky.app/,marketing/assets/social-square-logo-1080x1080.png,marketing/launch-kit.md#bluesky--mastodon,create profile and post launch note,Use repo link.
Mastodon Hachyderm,2,ready,yes,https://hachyderm.io/auth/sign_up,marketing/assets/social-square-logo-1080x1080.png,marketing/launch-kit.md#bluesky--mastodon,create profile and post launch note,Use developer audience instance.
LinkedIn page,3,ready,yes,https://www.linkedin.com/company/setup/new/,marketing/assets/homebrew-install-card-1200x675.png,marketing/launch-kit.md#linkedin,create page and post launch note,Owner admin verification required.
DEV Community,3,ready,yes,https://dev.to/enter,marketing/assets/rust-article-card-1200x675.png,marketing/channel-playbook.md#developer-blogs,publish explainer with canonical link,Use Markdown editor.
Hashnode,3,ready,yes,https://hashnode.com/onboard,marketing/assets/rust-article-card-1200x675.png,marketing/channel-playbook.md#developer-blogs,publish explainer mirror,Set canonical if available.
Medium,3,ready,yes,https://medium.com/,marketing/assets/not-transcript-dump-card-1080x1080.png,marketing/channel-playbook.md#developer-blogs,publish manifesto,Link to repo and feedback.
Substack,3,queued,yes,https://substack.com/signup,marketing/assets/social-square-banner-1080x1080.png,marketing/newsletter-pitches.md,create publication and first note,Use for release notes.
Product Hunt,4,hold,yes,https://www.producthunt.com/launch,marketing/assets/open-graph-1200x675.png,marketing/channel-playbook.md#product-hunt,wait for YouTube public URL,Coordinate launch day.
Rust This Week,3,ready,no,https://this-week-in-rust.org/,none,marketing/newsletter-pitches.md#rust-newsletter-pitch,submit project link,Use short Rust-focused pitch.
This Week in Rust draft PR,3,submitted,yes,https://github.com/rust-lang/this-week-in-rust/pull/8346,marketing/assets/twir-submission-card-1200x675.png,marketing/newsletter-pitches.md#this-week-in-rust-pr-snippet,monitor PR review and respond if editors request changes,Opened against issue 659 draft with Rust article link.
Awesome AI Agents lists,3,queued,depends,GitHub search,none,marketing/newsletter-pitches.md#directory-listing,identify active lists and open PRs,Use framework-agnostic wording.
Awesome AI SDKs PR #268,3,submitted,yes,https://github.com/e2b-dev/awesome-ai-sdks/pull/268,none,README.md,complete E2B CLA if owner accepts terms,Adds Tree Ring Memory to AI-agent SDK/tooling list; CLA check is currently error.
Awesome Rust CLI lists,3,queued,depends,GitHub search,none,marketing/newsletter-pitches.md#directory-listing,identify active lists and open PRs,Use CLI and TUI angle.
Awesome Command Line Tools PR #2,3,submitted,yes,https://github.com/ad-si/awesome-command-line-tools/pull/2,none,readme.md,monitor maintainer response,Adds Tree Ring Memory to Shell Utilities.
Awesome Agent Memory PR #53,3,submitted,yes,https://github.com/TeleAI-UAGI/Awesome-Agent-Memory/pull/53,none,README.md,monitor maintainer response,Adds Tree Ring Memory to open-source Products in an agent-memory directory.
Awesome TUIs PR #751,3,submitted,yes,https://github.com/rothgar/awesome-tuis/pull/751,none,README.md,monitor check and maintainer response,Adds Tree Ring Memory to the Development section of a terminal UI directory.
Awesome Ratatui PR #361,3,submitted,yes,https://github.com/ratatui/awesome-ratatui/pull/361,none,README.md,monitor checks and maintainer response,Adds Tree Ring Memory to Apps / Development Tools in the Ratatui ecosystem list.
Awesome CLI Apps CSV PR #303,3,submitted,yes,https://github.com/toolleeo/awesome-cli-apps-in-a-csv/pull/303,none,data/apps.csv,monitor maintainer response,Adds Tree Ring Memory to the source CSV for a large CLI/TUI index.
Awesome DevTools PR #299,3,submitted,yes,https://github.com/devtoolsd/awesome-devtools/pull/299,none,readme.md,monitor maintainer response,Adds Tree Ring Memory to AI Coding Tools in a developer-tool directory.
Awesome Coding Agents PR #12,3,submitted,yes,https://github.com/kailiu42/awesome-coding-agents/pull/12,none,README.md,monitor maintainer response,Adds Tree Ring Memory to CLI Agent Helpers in a coding-agent directory.
Command Line Tools listing,3,merged,yes,https://github.com/linsa-io/command-line-tools#rust,none,readme.md,monitor upstream listing,Lists Tree Ring Memory under Rust CLI tools in a command-line directory.
Awesome AI Agents PR #382,3,submitted,yes,https://github.com/jim-schwoebel/awesome_ai_agents/pull/382,none,README.md,monitor maintainer response,Adds Tree Ring Memory to Tools in a broad AI-agent directory.
Schickling Awesome Local-First PR #39,3,submitted,yes,https://github.com/schickling/awesome-local-first/pull/39,none,README.md,monitor maintainer response,Adds Tree Ring Memory to Libraries in a local-first directory.
Awesome AI Coding Tools PR #514,3,submitted,yes,https://github.com/ai-for-developers/awesome-ai-coding-tools/pull/514,none,README.md,monitor maintainer response,Adds Tree Ring Memory to Developer Productivity Tools in an AI coding-tools directory.
Awesome AI DevTools PR #779,3,submitted,yes,https://github.com/jamesmurdza/awesome-ai-devtools/pull/779,none,README.md,monitor maintainer response,Adds Tree Ring Memory to Configuration & Context Management; corrected PR after template-only closure of #778.
Awesome AI Coding Assistants Playbook PR #11,3,submitted,yes,https://github.com/CodandoTV/awesome-ai-coding-assistants-playbook/pull/11,none,README.md and README.pt-br.md,monitor maintainer response,Adds Tree Ring Memory to Skills & Config in English and Portuguese docs.
Awesome LLM CLI Apps PR #4,3,submitted,yes,https://github.com/jsnyder/awesome-llm-cli-apps/pull/4,none,README.md,monitor maintainer response,Adds Tree Ring Memory to Developer Tools in an LLM-agent CLI directory.
Awesome Vibe Coding Resources PR #39,3,submitted,yes,https://github.com/acvnace/awesome-vibe-coding-resources/pull/39,none,README.md,monitor maintainer response,Adds Tree Ring Memory to Command Line Tools near local memory/context tools.
Filipe Awesome Vibe Coding PR #249,3,submitted,yes,https://github.com/filipecalegario/awesome-vibe-coding/pull/249,none,README.md and translated mirrors,monitor maintainer response,Adds Tree Ring Memory to Command Line Tools across English and translated README mirrors.
AI-for-Developers Awesome Vibe Coding PR #99,3,submitted,yes,https://github.com/ai-for-developers/awesome-vibe-coding/pull/99,none,readme.md,monitor maintainer response,Adds Tree Ring Memory near memory-oriented CLI tools.
Taskade Awesome Vibe Coding PR #41,3,submitted,yes,https://github.com/taskade/awesome-vibe-coding/pull/41,none,README.md,monitor unstable PR and maintainer response,Adds Tree Ring Memory to AI Agent Memory and Context table; PR currently unstable with no exposed checks.
Awesome AI Coding Agent Tools PR #27,3,submitted,yes,https://github.com/namphuongtran/awesome-ai-coding-agent-tools/pull/27,none,README.md,monitor unstable PR and maintainer response,Adds Tree Ring Memory to Supporting Infrastructure / Memory; PR currently unstable with no exposed checks.
Mahseema Awesome AI Tools PR #1742,3,submitted,yes,https://github.com/mahseema/awesome-ai-tools/pull/1742,none,README.md,monitor maintainer response,Adds Tree Ring Memory to Developer tools in a broad AI-tools directory.
EUDK Awesome AI Tools PR #413,3,submitted,yes,https://github.com/eudk/awesome-ai-tools/pull/413,none,README.md,monitor maintainer response,Adds Tree Ring Memory to AI Agent Tools in a broad AI-tools directory.
Milisp Awesome Codex CLI PR #63,3,submitted,yes,https://github.com/milisp/awesome-codex-cli/pull/63,none,README.md,monitor maintainer response,Adds Tree Ring Memory to Development Tools in a Codex CLI directory.
JQueryScript Awesome Claude Code PR #483,3,submitted,yes,https://github.com/jqueryscript/awesome-claude-code/pull/483,none,README.md,monitor maintainer response,Adds Tree Ring Memory to Tools & Utilities in a broad Claude Code directory.
RoggeOhta Awesome Codex CLI PR #132,3,submitted,yes,https://github.com/RoggeOhta/awesome-codex-cli/pull/132,none,README.md,monitor stricter Codex-specific maintainer response,Adds Tree Ring Memory to Specialized Skills with Codex-style skill bridge guidance.
Heilcheng Awesome Agent Skills PR #331,3,submitted,yes,https://github.com/heilcheng/awesome-agent-skills/pull/331,none,README.md,monitor Vercel authorization failure and maintainer response,Adds Tree Ring Memory to Context Engineering in a large agent-skill directory; Vercel preview requires project authorization.
Kodus Awesome Agent Skills PR #51,3,submitted,yes,https://github.com/kodustech/awesome-agent-skills/pull/51,none,README.md,monitor maintainer response,Adds Tree Ring Memory to Tooling in a software-engineering agent-skill directory.
Skillmatic Awesome Agent Skills PR #126,3,submitted,yes,https://github.com/skillmatic-ai/awesome-agent-skills/pull/126,none,README.md,monitor maintainer response,Adds Tree Ring Memory as a developer-tool resource in an Agent Skills directory.
VoltAgent Awesome Agent Skills,3,hold,yes,https://github.com/VoltAgent/awesome-agent-skills,none,marketing/submission-ledger.csv,revisit after community adoption grows,Contribution rules focus on proven community-adopted skills and short descriptions.
JackyST0 Awesome Agent Skills,3,hold,yes,https://github.com/JackyST0/awesome-agent-skills,none,marketing/submission-ledger.csv,revisit after Tree Ring clears community star threshold,Contribution rules require community projects to have at least 64 GitHub stars by default.
Prat011 Awesome LLM Skills PR #169,3,submitted,yes,https://github.com/Prat011/awesome-llm-skills/pull/169,none,tree-ring-memory/SKILL.md,monitor maintainer response,Adds Tree Ring Memory as a hosted skill folder and Development & Code Tools README entry; GitGuardian check passed and PR is clean.
Composio Awesome Agent CLIs PR #19,3,submitted,yes,https://github.com/ComposioHQ/awesome-agent-clis/pull/19,none,README.md and tree-ring-memory-cli/SKILL.md,monitor maintainer response,Adds Tree Ring Memory under Memory & Context with agent-ready skill instructions; Socket checks passed and PR is clean.
Composio Awesome Claude Skills PR #1252,3,submitted,yes,https://github.com/ComposioHQ/awesome-claude-skills/pull/1252,none,README.md,monitor maintainer review,Adds Tree Ring Memory to Development & Code Tools; validator passed and ready-to-merge label applied.
HesReallyHim Awesome Claude Code,3,ready,yes,https://github.com/hesreallyhim/awesome-claude-code/issues/new?template=recommend-resource.yml,none,marketing/account-setup.md,submit recommendation manually in the web issue form if owner wants to pursue,Repository rules forbid PR/CLI resource recommendations and require the web issue form.
Awesome Local-First PR #42,3,submitted,yes,https://github.com/alexanderop/awesome-local-first/pull/42,none,README.md,monitor maintainer response,Adds Tree Ring Memory to Frameworks & Platforms.
Terminal Trove,3,drafted,yes,https://terminaltrove.com/post/,marketing/assets/terminal-trove-preview-1200x675.png,marketing/terminal-trove-submission.md,review and send Gmail draft,Email draft to curator@terminaltrove.com created with preview attached.
Discord community,4,hold,yes,https://discord.com/,marketing/assets/social-square-logo-1080x1080.png,marketing/account-setup.md#discord,create only when moderation capacity exists,Do not invite secrets or transcript dumps.
